Symbol,Name,Last Sale,Net Change,% Change,Market Cap,Country,IPO Year,Volume,Sector,Industry
RDCM,Radcom Ltd. Ordinary Shares,$10.345,-0.055,-0.529%,149855498.00,Israel,1997,13573,Technology,Computer peripheral equipment
RDFN,Redfin Corporation Common Stock,$8.42,-0.59,-6.548%,915664206.00,United States,2017,8019891,Finance,Real Estate
RDHL,Redhill Biopharma Ltd. American Depositary Shares,$0.2289,0.0019,0.837%,20876603.00,Israel,,2741341,Health Care,Biotechnology: Pharmaceutical Preparations
RDI,Reading International Inc Class A Common Stock,$3.58,0.04,1.13%,78916890.00,United States,,10081,Consumer Discretionary,Movies/Entertainment
RDIB,Reading International Inc Class B Common Stock,$21.88,1.03,4.94%,482318869.00,United States,,3231,Consumer Discretionary,Movies/Entertainment
RDNT,RadNet Inc. Common Stock,$21.72,0.56,2.647%,1245877662.00,United States,,152962,Health Care,Medical Specialities
RDVT,Red Violet Inc. Common Stock ,$22.30,0.99,4.646%,309831807.00,United States,,25981,Technology,Computer Software: Prepackaged Software
RDWR,Radware Ltd. Ordinary Shares,$21.05,-0.11,-0.52%,943898187.00,Israel,1999,95421,Technology,EDP Services
REAL,The RealReal Inc. Common Stock,$1.48,-0.13,-8.075%,145137354.00,United States,2019,4884071,Consumer Discretionary,Consumer Specialties
REAX,The Real Brokerage Inc. Common Shares,$1.40,-0.02,-1.408%,250392572.00,Canada,,14519,,
REBN,Reborn Coffee Inc. Common Stock,$0.9998,0.0032,0.321%,13116899.00,United States,2022,67076,Consumer Discretionary,Restaurants
REE,REE Automotive Ltd. Class A Ordinary Shares,$0.48,0.0055,1.159%,117000279.00,Israel,,466591,Consumer Discretionary,Auto Manufacturing
REFI,Chicago Atlantic Real Estate Finance Inc. Common Stock,$15.04,0.11,0.737%,265575012.00,United States,2021,47816,Real Estate,Real Estate Investment Trusts
REFR,Research Frontiers Incorporated Common Stock,$1.99,0.0701,3.651%,65969288.00,United States,,9422,Technology,Industrial Machinery/Components
REG,Regency Centers Corporation Common Stock,$64.33,-0.27,-0.418%,10978987203.00,United States,1993,858501,Real Estate,Real Estate Investment Trusts
REGN,Regeneron Pharmaceuticals Inc. Common Stock,$748.74,12.41,1.685%,81856398830.00,United States,1991,492719,Health Care,Biotechnology: Pharmaceutical Preparations
REKR,Rekor Systems Inc. Common Stock,$1.80,-0.14,-7.216%,97825592.00,United States,,247953,Technology,EDP Services
RELI,Reliance Global Group Inc. Common Stock,$0.5489,-0.0183,-3.226%,9910098.00,United States,,149409,Finance,Specialty Insurers
RELIW,Reliance Global Group Inc. Series A Warrants,$0.0984,-0.0222,-18.408%,0.00,United States,,6095,Finance,Specialty Insurers
RELL,Richardson Electronics Ltd. Common Stock,$23.91,-0.25,-1.035%,336525694.00,United States,1983,107258,Technology,Electronic Components
RELY,Remitly Global Inc. Common Stock,$11.76,-0.30,-2.488%,2007006323.00,United States,2021,1095980,Technology,Computer Software: Prepackaged Software
RENE,Cartesian Growth Corporation II Class A Ordinary Shares,$10.40,-0.01,-0.096%,299000000.00,United States,2022,85020,Finance,Blank Checks
RENEW,Cartesian Growth Corporation II Warrant,$0.20,-0.0001,-0.05%,0.00,United States,2022,46576,Finance,Blank Checks
RENT,Rent the Runway Inc. Class A Common Stock,$3.79,-0.19,-4.774%,246436363.00,United States,2021,656759,Consumer Discretionary,Department/Specialty Retail Stores
REPL,Replimune Group Inc. Common Stock,$24.82,0.56,2.308%,1406176455.00,United States,2018,463453,Health Care,Biotechnology: Pharmaceutical Preparations
RETA,Reata Pharmaceuticals Inc. Class A Common Stock,$48.83,6.14,14.383%,1789309674.00,United States,2016,1836321,Health Care,Biotechnology: Pharmaceutical Preparations
RETO,ReTo Eco-Solutions Inc. Common Shares,$0.3429,-0.0151,-4.218%,14781772.00,China,2017,248616,Consumer Discretionary,Multi-Sector Companies
REUN,Reunion Neuroscience Inc. Common Shares,$1.16,-0.02,-1.695%,13508376.00,Canada,,25118,Health Care,Pharmaceuticals and Biotechnology
REVB,Revelation Biosciences Inc. Common Stock,$2.48,-0.16,-6.061%,8831429.00,United States,2020,558060,Health Care,Biotechnology: Pharmaceutical Preparations
REVBW,Revelation Biosciences Inc. Warrant,$0.0263,0.0001,0.382%,0.00,United States,2020,90517,Health Care,Biotechnology: Pharmaceutical Preparations
REVE,Alpine Acquisition Corporation Common Stock,$10.51,-0.01,-0.095%,142410500.00,United States,2021,25198,Industrials,Consumer Electronics/Appliances
REVEU,Alpine Acquisition Corporation Unit,$10.01,-0.51,-4.848%,0.00,United States,2021,1032,Industrials,Consumer Electronics/Appliances
REVEW,Alpine Acquisition Corporation Warrant,$0.10,-0.02,-16.667%,0.00,United States,2021,7556,Industrials,Consumer Electronics/Appliances
REYN,Reynolds Consumer Products Inc. Common Stock,$28.15,0.42,1.515%,5907633823.00,United States,2020,200592,Industrials,Office Equipment/Supplies/Services
RFAC,RF Acquisition Corp. Class A Common Stock,$10.22,0.00,0.00%,148956500.00,Singapore,2022,1735,Industrials,Consumer Electronics/Appliances
RFACU,RF Acquisition Corp. Unit,$10.29,-0.02,-0.194%,0.00,Singapore,2022,100,Industrials,Consumer Electronics/Appliances
RFACW,RF Acquisition Corp. Warrants,$0.0225,0.00,0.00%,0.00,Singapore,2022,280,Industrials,Consumer Electronics/Appliances
RFIL,RF Industries Ltd. Common Stock,$5.365,-0.035,-0.648%,54686985.00,United States,,1264,Technology,Electrical Products
RGC,Regencell Bioscience Holdings Limited Ordinary Shares,$27.05,0.00,0.00%,351998025.00,Hong Kong,2021,23,Health Care, Medicinal Chemicals and Botanical Products 
RGCO,RGC Resources Inc. Common Stock,$24.32,0.02,0.082%,241028978.00,United States,,9654,Utilities,Oil & Gas Production
RGEN,Repligen Corporation Common Stock,$190.00,-8.10,-4.089%,10549643410.00,United States,1986,618209,Health Care,Medical/Dental Instruments
RGF,The Real Good Food Company Inc. Class A Common Stock,$4.56,-0.34,-6.939%,117408901.00,United States,2021,37388,Consumer Discretionary,Food Distributors
RGLD,Royal Gold Inc. Common Stock,$121.94,-0.82,-0.668%,8004593997.00,United States,,343646,Industrials,Consumer Electronics/Appliances
RGLS,Regulus Therapeutics Inc. Common Stock,$1.24,-0.05,-3.876%,20881924.00,United States,2012,47303,Health Care,Biotechnology: Pharmaceutical Preparations
RGNX,REGENXBIO Inc. Common Stock,$22.18,0.99,4.672%,960252736.00,United States,2015,464975,Health Care,Biotechnology: Biological Products (No Diagnostic Substances)
RGP,Resources Connection Inc. Common Stock,$18.30,0.04,0.219%,615507269.00,United States,,137225,Consumer Discretionary,Business Services
RGTI,Rigetti Computing Inc. Common Stock,$1.07,-0.05,-4.464%,131642158.00,United States,,562833,Technology,Retail: Computer Software & Peripheral Equipment
RGTIW,Rigetti Computing Inc. Warrants,$0.1789,0.0089,5.235%,0.00,United States,,51757,Technology,Retail: Computer Software & Peripheral Equipment
RIBT,RiceBran Technologies Common Stock,$1.215,-0.035,-2.80%,7584124.00,United States,,21881,Consumer Staples,Specialty Foods
RICK,RCI Hospitality Holdings Inc. Common Stock,$83.07,-4.33,-4.954%,766754791.00,United States,1995,158117,Consumer Discretionary,Restaurants
RIDE,Lordstown Motors Corp. Class A Common Stock,$1.30,0.00,0.00%,298861575.00,United States,2019,1458908,Consumer Discretionary,Construction/Ag Equipment/Trucks
RIGL,Rigel Pharmaceuticals Inc. Common Stock,$1.57,-0.02,-1.258%,271353048.00,United States,2000,1259351,Health Care,Biotechnology: Pharmaceutical Preparations
RILY,B. Riley Financial Inc. Common Stock,$43.10,-0.81,-1.845%,1226073674.00,United States,,437660,Finance,Investment Managers
RILYG,B. Riley Financial Inc. 5.00% Senior Notes due 2026,$19.85,-0.14,-0.70%,0.00,United States,,11070,Consumer Discretionary,Business Services
RILYK,B. Riley Financial Inc. 5.50% Senior Notes Due 2026,$21.16,-0.01,-0.047%,0.00,United States,,56210,Consumer Discretionary,Business Services
RILYL,B. Riley Financial Inc. Depositary Shares each representing 1/1000th in a share of 7.375% Series B Cumulative Perpetual Preferred Stock par value $0.0001,$23.81,-0.29,-1.203%,0.00,United States,,7223,Finance,Investment Managers
RILYM,B. Riley Financial Inc. 6.375% Senior Notes due 2025,$22.50,-0.23,-1.012%,0.00,United States,,21425,Consumer Discretionary,Business Services
RILYN,B. Riley Financial Inc. 6.50% Senior Notes Due 2026,$21.36,-0.01,-0.047%,0.00,United States,,14662,Consumer Discretionary,Business Services
RILYO,B. Riley Financial Inc. 6.75% Senior Notes due 2024,$23.67,-0.08,-0.337%,0.00,United States,,35628,Consumer Discretionary,Business Services
RILYP,B. Riley Financial Inc. Depositary Shares each representing a 1/1000th fractional interest in a share of Series A Cumulative Perpetual Preferred Stock,$21.30,0.08,0.377%,0.00,United States,,10283,Finance,Investment Managers
RILYT,B. Riley Financial Inc. 6.00% Senior Notes Due 2028,$19.505,-0.101,-0.515%,0.00,United States,,26223,Consumer Discretionary,Business Services
RILYZ,B. Riley Financial Inc. 5.25% Senior Notes due 2028,$18.14,-0.01,-0.055%,0.00,United States,,63689,Consumer Discretionary,Business Services
RIOT,Riot Platforms Inc. Common Stock ,$6.59,0.23,3.616%,1102486643.00,United States,,19105825,Technology,Retail: Computer Software & Peripheral Equipment
RIVN,Rivian Automotive Inc. Class A Common Stock,$20.22,-0.46,-2.224%,18621726377.00,United States,2021,16563448,Consumer Discretionary,Auto Manufacturing
RKDA,Arcadia Biosciences Inc. Common Stock,$0.2719,0.0021,0.778%,6700421.00,United States,2015,111140,Consumer Staples,Farming/Seeds/Milling
RKLB,Rocket Lab USA Inc. Common Stock,$4.91,-0.06,-1.207%,2323692808.00,United States,2020,3418468,Industrials,Aerospace
RLAY,Relay Therapeutics Inc. Common Stock,$18.45,1.00,5.731%,2230510923.00,United States,2020,840336,Health Care,Biotechnology: Pharmaceutical Preparations
RLMD,Relmada Therapeutics Inc. Common Stock,$3.67,0.11,3.09%,110464075.00,United States,,158609,Health Care,Biotechnology: Pharmaceutical Preparations
RLYB,Rallybio Corporation Common Stock,$7.05,0.13,1.879%,266759923.00,United States,2021,41425,Health Care,Biotechnology: Pharmaceutical Preparations
RMBI,Richmond Mutual Bancorporation Inc. Common Stock,$13.45,0.03,0.224%,158494800.00,United States,2019,3688,,
RMBL,RumbleOn Inc. Class B Common Stock,$8.31,-0.40,-4.592%,134569522.00,United States,,137437,Consumer Discretionary,Automotive Aftermarket
RMBS,Rambus Inc. Common Stock,$44.21,-0.81,-1.799%,4751779662.00,United States,1997,563999,Technology,Semiconductors
RMCF,Rocky Mountain Chocolate Factory Inc. Common Stock,$5.05,0.05,1.00%,31564000.00,United States,,3646,Consumer Staples,Specialty Foods
RMGC,RMG Acquisition Corp. III Class A Ordinary Shares,$10.00,-0.02,-0.20%,603750000.00,United States,2021,8849,Finance,Blank Checks
RMGCU,RMG Acquisition Corp. III Unit,$10.00,-0.0043,-0.043%,0.00,United States,2021,38247,Finance,Blank Checks
RMGCW,RMG Acquisition Corp. III Warrant,$0.1305,0.00,0.00%,0.00,United States,2021,122449,Finance,Blank Checks
RMNI,Rimini Street Inc. (DE) Common Stock,$4.91,0.03,0.615%,433444980.00,United States,2015,128648,Technology,EDP Services
RMR,The RMR Group Inc. Class A Common Stock,$29.68,-0.17,-0.57%,492784816.00,United States,,157397,Finance,Real Estate
RMTI,Rockwell Medical Inc. Common Stock,$2.51,-0.04,-1.569%,29198009.00,United States,1998,321104,Health Care,Biotechnology: Pharmaceutical Preparations
RNA,Avidity Biosciences Inc. Common Stock,$25.65,1.52,6.299%,1704763587.00,United States,2020,765403,Health Care,Biotechnology: Pharmaceutical Preparations
RNAZ,TransCode Therapeutics Inc. Common Stock,$0.5248,0.0205,4.065%,6810452.00,United States,2021,2628113,Health Care,Biotechnology: Pharmaceutical Preparations
RNER,Mount Rainier Acquisition Corp. Common Stock,$8.90,-0.19,-2.09%,67843828.00,United States,2022,1864,Industrials,Consumer Electronics/Appliances
RNERW,Mount Rainier Acquisition Corp. Warrant,$0.18,-0.02,-10.00%,0.00,United States,2022,14601,Industrials,Consumer Electronics/Appliances
RNLX,Renalytix plc American Depositary Shares,$3.39,0.07,2.108%,158677093.00,United Kingdom,2020,68393,Health Care,Medical Specialities
RNST,Renasant Corporation Common Stock,$37.38,-0.19,-0.506%,2091527028.00,United States,,204903,Finance,Major Banks
RNW,ReNew Energy Global plc Class A Ordinary Shares,$5.61,-0.22,-3.774%,2173668922.00,United Kingdom,,2026496,Utilities,Electric Utilities: Central
RNWWW,ReNew Energy Global plc Warrant,$0.69,-0.09,-11.538%,0.00,United Kingdom,,19904,Utilities,Electric Utilities: Central
RNXT,RenovoRx Inc. Common Stock,$4.10,0.014,0.343%,37300574.00,United States,2021,23266,Health Care,Biotechnology: Pharmaceutical Preparations
ROAD,Construction Partners Inc. Class A Common Stock,$29.25,-0.29,-0.982%,1542089513.00,United States,2018,158821,Industrials,Engineering & Construction
ROC,ROC Energy Acquisition Corp. Common Stock,$10.375,0.015,0.145%,278579125.00,United States,2021,558,Industrials,Consumer Electronics/Appliances
ROCAR,ROC Energy Acquisition Corp. Rights,$0.33,0.0093,2.90%,0.00,United States,2021,245908,Industrials,Consumer Electronics/Appliances
ROCAU,ROC Energy Acquisition Corp. Unit,$10.65,-0.0601,-0.561%,0.00,United States,2021,7745,Industrials,Consumer Electronics/Appliances
ROCC,Ranger Oil Corporation Class A Common Stock,$39.08,-3.47,-8.155%,746046540.00,United States,,380277,Energy,Oil & Gas Production
ROCG,Roth CH Acquisition IV Co. Common Stock,$10.40,0.00,0.00%,59433390.00,United States,2021,8,Industrials,Consumer Electronics/Appliances
ROCGW,Roth CH Acquisition IV Co. Warrant,$0.23,-0.011,-4.564%,0.00,United States,2021,5752,Industrials,Consumer Electronics/Appliances
ROCK,Gibraltar Industries Inc. Common Stock,$55.52,-0.36,-0.644%,1719508365.00,United States,1993,217006,,
ROCL,Roth CH Acquisition V Co. Common Stock,$10.23,0.00,0.00%,151777395.00,United States,2022,121,Industrials,Consumer Electronics/Appliances
ROCLW,Roth CH Acquisition V Co. Warrant,$0.0479,-0.0152,-24.089%,0.00,United States,2022,2302,Industrials,Consumer Electronics/Appliances
ROIC,Retail Opportunity Investments Corp. Common Stock (MD),$14.65,-0.08,-0.543%,1824493581.00,United States,,1129593,Real Estate,Real Estate Investment Trusts
ROIV,Roivant Sciences Ltd. Common Shares,$8.62,-0.11,-1.26%,6537643757.00,United Kingdom,,1549984,Health Care,Biotechnology: Pharmaceutical Preparations
ROIVW,Roivant Sciences Ltd. Warrant,$1.94,-0.12,-5.825%,0.00,United Kingdom,,59149,Health Care,Biotechnology: Pharmaceutical Preparations
ROKU,Roku Inc. Class A Common Stock,$71.56,0.99,1.403%,9966126565.00,United States,2017,19868292,Telecommunications,Cable & Other Pay Television Services
ROOT,Root Inc. Class A Common Stock,$6.18,-0.48,-7.207%,87138000.00,United States,2020,134882,Finance,Property-Casualty Insurers
ROSE,Rose Hill Acquisition Corporation Class A Ordinary Shares,$10.35,0.00,0.00%,200854688.00,United States,2021,106,Finance,Blank Checks
ROSEU,Rose Hill Acquisition Corporation Unit,$10.34,-0.03,-0.289%,0.00,United States,2021,100,Finance,Blank Checks
ROSEW,Rose Hill Acquisition Corporation Warrant,$0.1389,-0.0093,-6.275%,0.00,United States,2021,3228,Finance,Blank Checks
ROST,Ross Stores Inc. Common Stock,$115.69,0.37,0.321%,39840282031.00,United States,1985,1473050,Consumer Discretionary,Clothing/Shoe/Accessory Stores
ROVR,Rover Group Inc. Class A Common Stock,$3.93,-0.05,-1.256%,722149946.00,United States,2021,228004,Consumer Discretionary,Other Consumer Services
RPAY,Repay Holdings Corporation Class A Common Stock,$9.05,0.07,0.78%,820736129.00,United States,2018,932771,Technology,EDP Services
RPD,Rapid7 Inc. Common Stock,$49.70,0.82,1.678%,2944025224.00,United States,2015,621536,Technology,Computer Software: Prepackaged Software
RPHM,Reneo Pharmaceuticals Inc. Common Stock,$3.00,0.09,3.093%,73588938.00,United States,2021,54653,Health Care,Biotechnology: Pharmaceutical Preparations
RPID,Rapid Micro Biosystems Inc. Class A Common Stock,$1.20,-0.08,-6.25%,50393142.00,United States,2021,82869,Health Care,Medical Specialities
RPRX,Royalty Pharma plc Class A Ordinary Shares ,$37.84,0.60,1.611%,16769402575.00,United States,2020,2893200,Health Care,Biotechnology: Pharmaceutical Preparations
RPTX,Repare Therapeutics Inc. Common Shares,$11.50,0.49,4.45%,482557365.00,Canada,2020,118311,Health Care,Pharmaceuticals and Biotechnology
RRBI,Red River Bancshares Inc. Common Stock,$51.00,0.05,0.098%,366379665.00,United States,2019,5195,Finance,Commercial Banks
RRGB,Red Robin Gourmet Burgers Inc. Common Stock,$9.58,-0.61,-5.986%,152590671.00,United States,2002,308447,Consumer Discretionary,Restaurants
RRR,Red Rock Resorts Inc. Class A Common Stock,$46.24,-0.09,-0.194%,2681939375.00,United States,2016,453423,Consumer Discretionary,Recreational Games/Products/Toys
RSLS,ReShape Lifesciences Inc. Common Stock,$5.00,0.66,15.207%,8970990.00,United States,2016,3705080,Health Care,Biotechnology: Electromedical & Electrotherapeutic Apparatus
RSSS,Research Solutions Inc Common Stock,$2.27,0.02,0.889%,66204116.00,United States,,20424,Technology,Computer Software: Prepackaged Software
RSVR,Reservoir Media Inc. Common Stock,$6.99,-0.07,-0.992%,450052534.00,United States,2021,25934,Consumer Discretionary,Movies/Entertainment
RSVRW,Reservoir Media Inc. Warrant,$1.77,0.00,0.00%,0.00,United States,2021,19,Consumer Discretionary,Movies/Entertainment
RTC,Baijiayun Group Ltd. Class A Ordinary Shares,$9.30,-0.0325,-0.348%,779207996.00,China,2006,13609,Industrials,Specialty Chemicals
RTL,The Necessity Retail REIT Inc. Class A Common Stock,$6.66,0.01,0.15%,893933925.00,United States,,434960,Real Estate,Real Estate Investment Trusts
RTLPO,The Necessity Retail REIT Inc. 7.375% Series C Cumulative Redeemable Preferred Stock,$22.65,-0.435,-1.884%,0.00,United States,,4856,Real Estate,Real Estate Investment Trusts
RTLPP,The Necessity Retail REIT Inc. 7.50% Series A Cumulative Redeemable Perpetual Preferred Stock,$22.86,-0.19,-0.824%,0.00,United States,,4167,Real Estate,Real Estate Investment Trusts
RUBY,Rubius Therapeutics Inc. Common Stock,$0.1655,-0.0144,-8.004%,14956489.00,United States,2018,1542870,Health Care,Biotechnology: Biological Products (No Diagnostic Substances)
RUM,Rumble Inc. Class A Common Stock,$9.26,-0.15,-1.594%,2584743587.00,United States,2021,275129,Technology,Computer Software: Prepackaged Software
RUMBW,Rumble Inc. Warrant,$2.15,-0.03,-1.376%,0.00,United States,2021,4632,Technology,Computer Software: Prepackaged Software
RUN,Sunrun Inc. Common Stock,$25.21,0.66,2.688%,5372344756.00,United States,2015,6284062,Industrials,Building Products
RUSHA,Rush Enterprises Inc. Common Stock Cl A,$60.16,-1.19,-1.94%,3274415311.00,United States,,321537,Consumer Discretionary,Other Specialty Stores
RUSHB,Rush Enterprises Inc. Class B,$62.72,-2.18,-3.359%,3413752133.00,United States,,19410,Consumer Discretionary,Other Specialty Stores
RUTH,Ruth's Hospitality Group Inc. Common Stock,$17.68,0.25,1.434%,587013764.00,United States,2005,593300,Consumer Discretionary,Restaurants
RVLP,RVL Pharmaceuticals plc Ordinary Shares,$1.33,0.10,8.13%,132013123.00,United States,2018,65112,Health Care,Biotechnology: Pharmaceutical Preparations
RVMD,Revolution Medicines Inc. Common Stock,$25.59,0.11,0.432%,2272156546.00,United States,2020,1071901,Health Care, Medicinal Chemicals and Botanical Products 
RVNC,Revance Therapeutics Inc. Common Stock,$33.78,1.02,3.114%,2779201600.00,United States,2014,1155210,Health Care,Biotechnology: Pharmaceutical Preparations
RVPH,Reviva Pharmaceuticals Holdings Inc. Common Stock ,$4.75,0.16,3.486%,24389127.00,United States,2020,112551,Health Care,Biotechnology: Pharmaceutical Preparations
RVPHW,Reviva Pharmaceuticals Holdings Inc. Warrants,$1.0207,0.0417,4.259%,0.00,United States,2018,15797,Health Care,Biotechnology: Pharmaceutical Preparations
RVSB,Riverview Bancorp Inc Common Stock,$7.15,-0.02,-0.279%,153698795.00,United States,,21668,Finance,Major Banks
RVSN,Rail Vision Ltd. Ordinary Share,$1.77,-0.23,-11.50%,28135991.00,Israel,2022,252934,,
RVSNW,Rail Vision Ltd. Warrant,$0.40,0.115,40.351%,0.00,Israel,2022,40760,,
RVYL,Ryvyl Inc. Common Stock,$0.50,-0.0055,-1.088%,24823766.00,United States,,61247,Technology,EDP Services
RWAY,Runway Growth Finance Corp. Common Stock,$12.85,-0.27,-2.058%,520734981.00,United States,2021,66935,,
RWAYL,Runway Growth Finance Corp. 7.50% Notes due 2027,$24.8201,-0.1797,-0.719%,0.00,United States,,1507,,
RWAYZ,Runway Growth Finance Corp. 8.00% Notes due 2027,$25.14,0.00,0.00%,0.00,United States,,3573,,
RWLK,ReWalk Robotics Ltd. Ordinary Shares,$0.79,-0.01,-1.25%,48994899.00,Israel,2014,98915,Health Care,Industrial Specialties
RWOD,Redwoods Acquisition Corp. Common Stock,$10.20,0.00,0.00%,152031000.00,United States,2022,1644,Industrials,Consumer Electronics/Appliances
RWODU,Redwoods Acquisition Corp. Unit,$10.36,0.00,0.00%,0.00,United States,2022,100,Industrials,Consumer Electronics/Appliances
RWODW,Redwoods Acquisition Corp. Warrants,$0.03,-0.0025,-7.692%,0.00,United States,2022,47100,Industrials,Consumer Electronics/Appliances
RXDX,Prometheus Biosciences Inc. Common Stock,$124.31,3.54,2.931%,5778886111.00,United States,2021,656539,Health Care,Biotechnology: Pharmaceutical Preparations
RXRX,Recursion Pharmaceuticals Inc. Class A Common Stock,$7.99,0.17,2.174%,1514550403.00,United States,2021,886581,Health Care,Biotechnology: Pharmaceutical Preparations
RXST,RxSight Inc. Common Stock,$13.90,0.69,5.223%,459768187.00,United States,2021,67084,Health Care,Biotechnology: Electromedical & Electrotherapeutic Apparatus
RXT,Rackspace Technology Inc. Common Stock,$2.93,-0.08,-2.658%,618551937.00,United States,2020,894707,Technology,EDP Services
RYAAY,Ryanair Holdings plc American Depositary Shares,$94.27,-0.18,-0.191%,21468380954.00,Ireland,1997,425197,Consumer Discretionary,Air Freight/Delivery Services
RYTM,Rhythm Pharmaceuticals Inc. Common Stock,$26.60,0.82,3.181%,1498865605.00,United States,2017,275991,Health Care,Biotechnology: Pharmaceutical Preparations
RZLT,Rezolute Inc. Common Stock (NV),$2.62,0.11,4.382%,96488226.00,United States,,7721,Health Care,Biotechnology: Pharmaceutical Preparations
SABR,Sabre Corporation Common Stock,$5.32,-0.45,-7.799%,1746881643.00,United States,2014,10993912,Consumer Discretionary,Other Consumer Services
SABRP,Sabre Corporation 6.50% Series A Mandatory Convertible Preferred Stock,$77.97,-2.30,-2.865%,0.00,United States,,112774,Consumer Discretionary,Other Consumer Services
SABS,SAB Biotherapeutics Inc. Common Stock,$0.6932,0.033,4.998%,34935729.00,United States,2021,15468,Health Care,Biotechnology: Pharmaceutical Preparations
SABSW,SAB Biotherapeutics Inc. Warrant,$0.07,0.0178,34.10%,0.00,United States,2021,2447,Health Care,Biotechnology: Pharmaceutical Preparations
SAFT,Safety Insurance Group Inc. Common Stock,$87.37,2.32,2.728%,1287625685.00,United States,2002,66458,Finance,Property-Casualty Insurers
SAGAR,Sagaliam Acquisition Corp. Rights,$0.1499,0.0137,10.059%,0.00,United States,2022,600,Finance,Blank Checks
SAGE,Sage Therapeutics Inc. Common Stock,$45.52,0.46,1.021%,2708153406.00,United States,2014,478007,Health Care,Biotechnology: Pharmaceutical Preparations
SAI,SAI.TECH Global Corporation Class A Ordinary Shares,$1.28,0.01,0.787%,28882287.00,Singapore,2021,5399,Finance,Investment Bankers/Brokers/Service
SAIA,Saia Inc. Common Stock,$282.86,5.54,1.998%,7485172284.00,United States,,370939,Industrials,Trucking Freight/Courier Services
SAITW,SAI.TECH Global Corporation Warrant,$0.0951,-0.0049,-4.90%,0.00,Singapore,2021,10537,Finance,Investment Bankers/Brokers/Service
SAL,Salisbury Bancorp Inc. Common Stock,$29.55,0.30,1.026%,171355013.00,United States,,6695,Finance,Savings Institutions
SALM,Salem Media Group Inc. Class A Common Stock,$1.33,-0.01,-0.746%,36198327.00,United States,1999,16159,Consumer Discretionary,Broadcasting
SAMA,Schultze Special Purpose Acquisition Corp. II Class A Common Stock,$10.22,0.02,0.196%,210787500.00,United States,2021,1809,Industrials,Consumer Electronics/Appliances
SAMAU,Schultze Special Purpose Acquisition Corp. II Units,$10.20,0.00,0.00%,0.00,United States,2021,2,Industrials,Consumer Electronics/Appliances
SAMG,Silvercrest Asset Management Group Inc. Class A Common Stock,$19.50,0.21,1.089%,282139143.00,United States,2013,12579,Finance,Investment Managers
SANA,Sana Biotechnology Inc. Common Stock,$4.38,0.07,1.624%,835381829.00,United States,2021,617447,Health Care, Medicinal Chemicals and Botanical Products 
SANG,Sangoma Technologies Corporation Common Shares,$3.82,0.07,1.867%,88113564.00,Canada,,23312,,
SANM,Sanmina Corporation Common Stock,$63.53,-0.39,-0.61%,3707462521.00,United States,1993,393564,Technology,Electrical Products
SANW,S&W Seed Company Common Stock (NV),$1.85,0.01,0.543%,79153295.00,United States,,35725,Consumer Staples,Farming/Seeds/Milling
SASI,Sigma Additive Solutions Inc. Common Stock,$0.62,0.0102,1.673%,3614600.00,United States,,5664,Technology,EDP Services
SASR,Sandy Spring Bancorp Inc. Common Stock,$34.48,0.90,2.68%,1539775222.00,United States,,258424,Finance,Major Banks
SATL,Satellogic Inc. Class A Ordinary Shares,$2.99,-0.265,-8.141%,266092497.00,Uruguay,,221242,Technology,Radio And Television Broadcasting And Communications Equipment
SATLW,Satellogic Inc. Warrant,$0.31,0.0501,19.277%,0.00,Uruguay,,727,Technology,Radio And Television Broadcasting And Communications Equipment
SATS,EchoStar  Corporation Common Stock,$18.29,0.56,3.158%,1520463923.00,United States,,184388,Technology,Radio And Television Broadcasting And Communications Equipment
SAVA,Cassava Sciences Inc. Common Stock,$27.00,0.65,2.467%,1126860039.00,United States,,718792,Health Care,Biotechnology: Pharmaceutical Preparations
SBAC,SBA Communications Corporation Class A Common Stock,$281.24,-2.35,-0.829%,30364227907.00,United States,1999,724738,Real Estate,Real Estate Investment Trusts
