Symbol,Name,Last Sale,Net Change,% Change,Market Cap,Country,IPO Year,Volume,Sector,Industry
CSQ,Calamos Strategic Total Return Common Stock,$14.35,-0.14,-0.966%,2280037376.00,United States,2004,485016,Finance,Finance Companies
CSSE,Chicken Soup for the Soul Entertainment Inc. Class A Common Stock,$5.31,-0.09,-1.667%,67165648.00,United States,2017,61865,Consumer Discretionary,Movies/Entertainment
CSSEL,Chicken Soup for the Soul Entertainment Inc. Warrant,$0.0376,-0.0018,-4.569%,0.00,United States,,38442,Consumer Discretionary,Movies/Entertainment
CSSEN,Chicken Soup for the Soul Entertainment Inc. 9.50% Notes due 2025,$25.33,-0.06,-0.236%,0.00,United States,,3765,Consumer Discretionary,Movies/Entertainment
CSSEP,Chicken Soup for the Soul Entertainment Inc. 9.75% Series A Cumulative Redeemable Perpetual Preferred Stock,$19.935,-0.005,-0.025%,0.00,United States,,12390,Consumer Discretionary,Movies/Entertainment
CSTE,Caesarstone Ltd. Ordinary Shares,$6.07,-0.04,-0.655%,209430041.00,Israel,2012,69469,Consumer Discretionary,Multi-Sector Companies
CSTL,Castle Biosciences Inc. Common Stock,$26.00,0.01,0.038%,685140976.00,United States,2019,91469,Health Care,Medical Specialities
CSTR,CapStar Financial Holdings Inc. Common Stock,$17.68,0.13,0.741%,383910238.00,United States,2016,33033,Finance,Major Banks
CSWC,Capital Southwest Corporation Common Stock,$19.39,0.17,0.884%,670099669.00,United States,,378963,Finance,Finance/Investors Services
CSWI,CSW Industrials Inc. Common Stock,$141.12,1.14,0.814%,2183821416.00,United States,,50826,Industrials,Home Furnishings
CSX,CSX Corporation Common Stock,$31.21,0.10,0.321%,65616176432.00,United States,,12394192,Industrials,Railroads
CTAS,Cintas Corporation Common Stock,$444.10,2.74,0.621%,45129654724.00,United States,1983,343309,Consumer Discretionary,Business Services
CTBI,Community Trust Bancorp Inc. Common Stock,$44.12,0.75,1.729%,790554514.00,United States,,42776,Finance,Major Banks
CTG,Computer Task Group Inc. Common Stock,$7.40,0.04,0.543%,116272137.00,United States,,13862,Technology,EDP Services
CTHR,Charles & Colvard Ltd Common Stock,$0.8799,-0.0099,-1.113%,26857808.00,United States,1997,27131,Consumer Discretionary,Consumer Specialties
CTIB,Yunhong CTI Ltd. Common Stock,$1.52,-0.0101,-0.66%,24409818.00,United States,1997,76845,Miscellaneous,Diversified Commercial Services
CTIC,CTI BioPharma Corp. (DE) Common Stock,$5.49,0.17,3.195%,696649174.00,United States,1997,2797612,Health Care,Biotechnology: Pharmaceutical Preparations
CTKB,Cytek Biosciences Inc. Common Stock,$11.54,-0.24,-2.037%,1556207763.00,United States,2021,412164,Health Care,Biotechnology: Electromedical & Electrotherapeutic Apparatus
CTLP,Cantaloupe Inc. Common Stock,$6.00,0.69,12.994%,434777814.00,United States,,1637547,Technology,EDP Services
CTMX,CytomX Therapeutics Inc. Common Stock,$2.36,0.08,3.509%,155959106.00,United States,2015,673180,Health Care,Biotechnology: Pharmaceutical Preparations
CTRM,Castor Maritime Inc. Common Shares,$1.30,0.02,1.563%,122993114.00,Cyprus,,217956,Consumer Discretionary,Marine Transportation
CTRN,Citi Trends Inc. Common Stock,$28.75,-0.68,-2.311%,240242303.00,United States,2005,133275,,
CTSH,Cognizant Technology Solutions Corporation Class A Common Stock,$65.48,-0.88,-1.326%,33329320000.00,United States,1998,3784921,Technology,EDP Services
CTSO,Cytosorbents Corporation Common Stock,$3.50,-0.01,-0.285%,152725003.00,United States,,39564,Health Care,Medical/Dental Instruments
CTXR,Citius Pharmaceuticals Inc. Common Stock,$1.22,0.00,0.00%,178434512.00,United States,,787548,Health Care,Biotechnology: Pharmaceutical Preparations
CUBA,Herzfeld Caribbean Basin Fund Inc. (The) Common Stock,$4.06,-0.01,-0.246%,27019142.00,United States,,4142,Finance,Investment Managers
CUE,Cue Biopharma Inc. Common Stock,$3.18,-0.03,-0.935%,136875303.00,United States,2018,108403,Health Care,Biotechnology: Pharmaceutical Preparations
CUEN,Cuentas Inc. Common Stock,$0.9851,-0.0148,-1.48%,24875616.00,United States,,74932,Technology,Computer Software: Prepackaged Software
CUENW,Cuentas Inc. Warrant,$0.14,0.0076,5.74%,0.00,United States,,1421,Technology,Computer Software: Prepackaged Software
CULL,Cullman Bancorp Inc. Common Stock,$11.71,0.00,0.00%,86723007.00,United States,2021,2579,Finance,Savings Institutions
CURI,CuriosityStream Inc. Class A Common Stock,$1.83,0.01,0.549%,96635190.00,United States,2020,58195,Industrials,Broadcasting
CURIW,CuriosityStream Inc. Warrant,$0.14,0.0163,13.177%,0.00,United States,2020,500,Industrials,Broadcasting
CUTR,Cutera Inc. Common Stock,$33.19,-1.09,-3.18%,651037715.00,United States,2004,439658,Health Care,Biotechnology: Electromedical & Electrotherapeutic Apparatus
CVAC,CureVac N.V. Ordinary Shares,$8.91,0.03,0.338%,1977852964.00,Germany,2020,732257,Health Care,Biotechnology: Pharmaceutical Preparations
CVBF,CVB Financial Corporation Common Stock,$24.36,0.18,0.744%,3405983605.00,United States,,877364,Finance,Major Banks
CVCO,Cavco Industries Inc. Common Stock When Issued,$284.83,-2.62,-0.911%,2476226286.00,United States,,61820,Consumer Discretionary,Homebuilding
CVCY,Central Valley Community Bancorp Common Stock,$25.95,0.08,0.309%,304530801.00,United States,,18031,Finance,Major Banks
CVGI,Commercial Vehicle Group Inc. Common Stock,$8.21,-0.03,-0.364%,274000392.00,United States,2004,134560,Consumer Discretionary,Auto Parts:O.E.M.
CVGW,Calavo Growers Inc. Common Stock,$33.36,1.25,3.893%,591528211.00,United States,,67040,Consumer Discretionary,Specialty Foods
CVKD,Cadrenal Therapeutics Inc. Common Stock,$2.25,0.05,2.273%,26177794.00,United States,2023,66570,Health Care, Medicinal Chemicals and Botanical Products 
CVLG,Covenant Logistics Group Inc. Class A Common Stock,$34.95,1.37,4.08%,471625436.00,United States,,86151,Industrials,Trucking Freight/Courier Services
CVLT,Commvault Systems Inc. Common Stock,$62.33,-0.51,-0.812%,2777007501.00,United States,2006,265214,Technology,Computer Software: Prepackaged Software
CVLY,Codorus Valley Bancorp Inc Common Stock,$25.25,0.25,1.00%,241920250.00,United States,,8078,Finance,Savings Institutions
CVRX,CVRx Inc. Common Stock,$17.20,-0.30,-1.714%,355875757.00,United States,2021,46801,Health Care,Biotechnology: Electromedical & Electrotherapeutic Apparatus
CVT,Cvent Holding Corp. Common Stock,$7.89,-0.01,-0.127%,3849699057.00,United States,1987,255743,Technology,Computer Software: Prepackaged Software
CVV,CVD Equipment Corporation Common Stock,$13.80,-0.40,-2.817%,93300944.00,United States,,67975,Technology,Industrial Machinery/Components
CWBC,Community West Bancshares Common Stock,$15.03,0.02,0.133%,132233940.00,United States,,733,Finance,Major Banks
CWBR,CohBar Inc. Common Stock,$2.25,-0.02,-0.881%,6540584.00,United States,,10653,Health Care,Biotechnology: In Vitro & In Vivo Diagnostic Substances
CWCO,Consolidated Water Co. Ltd. Ordinary Shares,$15.30,0.05,0.328%,239605512.00,Cayman Islands,,27258,Utilities,Water Supply
CWST,Casella Waste Systems Inc. Class A Common Stock,$77.14,-3.00,-3.743%,3986614716.00,United States,1997,1030790,Utilities,Environmental Services
CXDO,Crexendo Inc. Common Stock,$1.985,-0.015,-0.75%,50057144.00,United States,,33849,Consumer Discretionary,Telecommunications Equipment
CYAD,Celyad Oncology SA American Depositary Shares,$1.22,0.08,7.018%,27564626.00,Belgium,2015,276433,Health Care,Biotechnology: Pharmaceutical Preparations
CYAN,Cyanotech Corporation Common Stock,$1.32,0.0306,2.373%,8279002.00,United States,,4865,Consumer Staples,Farming/Seeds/Milling
CYBR,CyberArk Software Ltd. Ordinary Shares,$146.13,0.09,0.062%,5949877157.00,Israel,2014,191157,Technology,Computer Software: Prepackaged Software
CYCC,Cyclacel Pharmaceuticals Inc. Common Stock,$1.10,-0.05,-4.348%,13793108.00,United States,,35050,Health Care,Biotechnology: Pharmaceutical Preparations
CYCCP,Cyclacel Pharmaceuticals Inc. 6% Convertible Preferred Stock,$12.39,0.25,2.059%,0.00,United States,,3601,Health Care,Biotechnology: Pharmaceutical Preparations
CYCN,Cyclerion Therapeutics Inc. Common Stock,$0.7928,0.0593,8.085%,34482189.00,United States,,121194,Health Care,Biotechnology: Pharmaceutical Preparations
CYN,Cyngn Inc. Common Stock,$0.98,-0.12,-10.909%,33007174.00,United States,2021,567907,Technology,EDP Services
CYRN,CYREN Ltd. Ordinary Shares,$0.43,-0.0203,-4.508%,3439917.00,United States,,53884,Technology,Computer Software: Prepackaged Software
CYRX,CryoPort Inc. Common Stock,$21.03,-0.27,-1.268%,1030466614.00,United States,,222186,,
CYT,Cyteir Therapeutics Inc. Common Stock,$1.52,0.005,0.33%,53867146.00,United States,2021,20183,Health Care,Biotechnology: Pharmaceutical Preparations
CYTH,Cyclo Therapeutics Inc. Common Stock,$1.20,0.07,6.195%,11775053.00,United States,,189895,Health Care,Biotechnology: Pharmaceutical Preparations
CYTHW,Cyclo Therapeutics Inc. Warrant,$0.25,0.014,5.932%,0.00,United States,,7260,Health Care,Biotechnology: Pharmaceutical Preparations
CYTK,Cytokinetics Incorporated Common Stock,$45.71,1.58,3.58%,4325583056.00,United States,2004,749452,Health Care,Biotechnology: Pharmaceutical Preparations
CYTO,Altamira Therapeutics Ltd. 0.2 Common Shares (Bermuda),$2.47,-0.06,-2.372%,3201350.00,Bermuda,2014,31415,Health Care,Biotechnology: Pharmaceutical Preparations
CYXT,Cyxtera Technologies Inc. Class A Common Stock,$2.48,-0.25,-9.158%,445451417.00,United States,2020,369076,Technology,EDP Services
CZFS,Citizens Financial Services Inc. Common Stock,$85.87,-1.425,-1.632%,341007717.00,United States,,3678,Finance,Major Banks
CZNC,Citizens & Northern Corp Common Stock,$22.80,0.20,0.885%,353829073.00,United States,,25977,Finance,Major Banks
CZR,Caesars Entertainment Inc. Common Stock,$52.80,0.62,1.188%,11329090344.00,United States,,3455534,Consumer Discretionary,Hotels/Resorts
CZWI,Citizens Community Bancorp Inc. Common Stock,$12.78,0.24,1.914%,133233021.00,United States,2006,3379,Finance,Savings Institutions
DADA,Dada Nexus Limited American Depositary Shares,$10.78,-0.53,-4.686%,2755250552.00,China,2020,952833,Consumer Discretionary,Department/Specialty Retail Stores
DAIO,Data I/O Corporation Common Stock,$4.24,0.02,0.474%,37381455.00,United States,1981,2234,Technology,Industrial Machinery/Components
DAKT,Daktronics Inc. Common Stock,$4.06,-0.05,-1.217%,184590856.00,United States,1994,44470,Industrials,Office Equipment/Supplies/Services
DALN,DallasNews Corporation Series A Common Stock,$4.31,-0.03,-0.691%,23069232.00,United States,,6592,Consumer Discretionary,Newspapers/Magazines
DALS,DA32 Life Science Tech Acquisition Corp. Class A Common Stock,$10.08,0.00,0.00%,258552000.00,United States,2021,5764,Industrials,Consumer Electronics/Appliances
DARE,Dare Bioscience Inc. Common Stock,$1.10,-0.01,-0.901%,93280000.00,United States,2014,553057,Health Care,Biotechnology: Pharmaceutical Preparations
DATS,DatChat Inc. Common Stock,$0.6705,0.0306,4.782%,13810569.00,United States,2021,143001,Technology,Computer Software: Prepackaged Software
DATSW,DatChat Inc. Series A Warrant,$0.085,0.00,0.00%,0.00,United States,2021,10,Technology,Computer Software: Prepackaged Software
DAVE,Dave Inc. Class A Common Stock,$8.71,0.25,2.955%,102915949.00,United States,,16526,Technology,Retail: Computer Software & Peripheral Equipment
DAVEW,Dave Inc. Warrants,$0.0568,-0.0002,-0.351%,0.00,United States,,25291,Technology,Retail: Computer Software & Peripheral Equipment
DAWN,Day One Biopharmaceuticals Inc. Common Stock,$20.05,0.50,2.558%,1474667996.00,United States,2021,332774,Health Care,Biotechnology: Pharmaceutical Preparations
DBGI,Digital Brands Group Inc. Common Stock,$2.04,-0.16,-7.273%,10085636.00,United States,2021,498049,Consumer Discretionary,Apparel
DBGIW,Digital Brands Group Inc. Warrant,$1.81,-0.08,-4.233%,0.00,United States,2021,902,Consumer Discretionary,Apparel
DBTX,Decibel Therapeutics Inc. Common Stock,$4.305,-0.065,-1.487%,107472181.00,United States,2021,28769,Health Care,Biotechnology: Pharmaceutical Preparations
DBVT,DBV Technologies S.A. American Depositary Shares,$1.35,0.06,4.651%,253710606.00,France,2014,28616,Health Care,Biotechnology: Pharmaceutical Preparations
DBX,Dropbox Inc. Class A Common Stock,$21.22,-2.74,-11.436%,7697265941.00,United States,2018,11639420,Technology,Computer Software: Prepackaged Software
DCBO,Docebo Inc. Common Shares,$37.71,-0.52,-1.36%,1240902757.00,Canada,,33903,,
DCFC,Tritium DCFC Limited Ordinary Shares,$2.07,0.19,10.106%,321861932.00,Australia,,5133908,Technology,Electronic Components
DCFCW,Tritium DCFC Limited Warrant,$0.5399,0.0599,12.479%,0.00,Australia,,101753,Technology,Electronic Components
DCGO,DocGo Inc. Common Stock,$9.21,-0.08,-0.861%,943206802.00,United States,2020,493437,Health Care,Managed Health Care
DCOM,Dime Community Bancshares Inc. Common Stock,$31.06,0.21,0.681%,1198098097.00,United States,,141832,Finance,Savings Institutions
DCOMP,Dime Community Bancshares Inc. Fixed-Rate Non-Cumulative Perpetual Preferred Stock Series A,$21.33,0.13,0.613%,0.00,United States,,7982,Finance,Savings Institutions
DCPH,Deciphera Pharmaceuticals Inc. Common Stock,$14.84,0.06,0.406%,1127057695.00,United States,2017,667876,Health Care,Biotechnology: Pharmaceutical Preparations
DCRD,Decarbonization Plus Acquisition Corporation IV Class A Ordinary Share,$9.53,-0.13,-1.346%,376732813.00,United States,2021,1171,Finance,Blank Checks
DCRDW,Decarbonization Plus Acquisition Corporation IV Warrant,$0.70,0.0006,0.086%,0.00,United States,2021,15200,Finance,Blank Checks
DCT,Duck Creek Technologies Inc. Common Stock,$18.88,0.03,0.159%,2508929386.00,United States,2020,2388684,Technology,Retail: Computer Software & Peripheral Equipment
DCTH,Delcath Systems Inc. Common Stock,$5.06,0.11,2.222%,50835649.00,United States,,15389,Health Care,Medical Specialities
DDI,DoubleDown Interactive Co. Ltd. American Depository Shares,$9.76,-0.05,-0.51%,483641574.00,South Korea,2021,17273,Technology,EDP Services
DDOG,Datadog Inc. Class A Common Stock,$79.99,-2.48,-3.007%,25401611442.00,United States,2019,5962590,Technology,EDP Services
DECA,Denali Capital Acquisition Corp. Class A Ordinary Shares,$10.38,0.01,0.096%,112337550.00,United States,2022,16915,Finance,Blank Checks
DECAU,Denali Capital Acquisition Corp. Unit,$10.4001,0.00,0.00%,0.00,United States,2022,15,Finance,Blank Checks
DENN,Denny's Corporation Common Stock,$12.47,-0.27,-2.119%,713698927.00,United States,,671020,Consumer Discretionary,Restaurants
DERM,Journey Medical Corporation Common Stock,$2.183,0.053,2.488%,38782523.00,United States,2021,20014,Health Care,Biotechnology: Pharmaceutical Preparations
DFFN,Diffusion Pharmaceuticals Inc. Common Stock,$6.0003,-0.4297,-6.683%,12237264.00,United States,,25834,Health Care,Biotechnology: Pharmaceutical Preparations
DFLI,Dragonfly Energy Holdings Corp. Common Stock,$5.85,-0.31,-5.032%,253145459.00,United States,2021,119309,Technology,Electronic Components
DFLIW,Dragonfly Energy Holdings Corp. Warrant,$0.377,0.0317,9.18%,0.00,United States,2021,22667,Technology,Electronic Components
DGHI,Digihost Technology Inc. Common Subordinate Voting Shares,$1.74,-0.09,-4.918%,48411695.00,Canada,,78841,,
DGICA,Donegal Group Inc. Class A Common Stock,$15.24,-0.05,-0.327%,494813478.00,United States,,65563,Finance,Property-Casualty Insurers
DGICB,Donegal Group Inc. Class B Common Stock,$15.21,-0.27,-1.744%,493839436.00,United States,1986,390,Finance,Property-Casualty Insurers
DGII,Digi International Inc. Common Stock,$34.50,0.28,0.818%,1233155822.00,United States,1989,203142,Technology,Computer peripheral equipment
DGLY,Digital Ally Inc. Common Stock,$5.25,0.14,2.74%,14464643.00,United States,,79503,Technology,Security Systems Services
DGNU,Dragoneer Growth Opportunities Corp. III Class A Ordinary Shares,$9.88,0.00,0.00%,531884939.00,United States,2021,41702,Finance,Blank Checks
DH,Definitive Healthcare Corp. Class A Common Stock,$12.28,-1.34,-9.838%,1290383161.00,United States,2021,2313379,Technology,Computer Software: Prepackaged Software
DHAC,Digital Health Acquisition Corp. Common Stock,$11.11,0.00,0.00%,45841227.00,United States,2021,1,Industrials,Consumer Electronics/Appliances
DHC,Diversified Healthcare Trust Common Shares of Beneficial Interest,$0.8625,0.0601,7.49%,206744407.00,United States,,6051694,Real Estate,Real Estate Investment Trusts
DHCA,DHC Acquisition Corp. Class A ordinary share,$10.17,0.00,0.00%,393389228.00,United States,2021,4647,Finance,Blank Checks
DHCAU,DHC Acquisition Corp. Unit,$10.15,0.00,0.00%,0.00,United States,2021,201,Finance,Blank Checks
DHCAW,DHC Acquisition Corp. Warrant,$0.0455,0.00,0.00%,0.00,United States,2021,67,Finance,Blank Checks
DHCNI,Diversified Healthcare Trust 5.625% Senior Notes due 2042,$12.05,-0.06,-0.495%,0.00,United States,,123472,Real Estate,Real Estate Investment Trusts
DHCNL,Diversified Healthcare Trust 6.25% Senior Notes Due 2046,$12.90,-0.10,-0.769%,0.00,United States,,41045,Real Estate,Real Estate Investment Trusts
DHHC,DiamondHead Holdings Corp. Class A Common Stock,$10.10,0.03,0.298%,131966923.00,United States,2021,211,Industrials,Consumer Electronics/Appliances
DHHCU,DiamondHead Holdings Corp. Unit,$10.075,0.095,0.952%,0.00,United States,2021,266,Industrials,Consumer Electronics/Appliances
DHHCW,DiamondHead Holdings Corp. Warrant,$0.2795,0.0224,8.713%,0.00,United States,2021,12800,Industrials,Consumer Electronics/Appliances
DHIL,Diamond Hill Investment Group Inc. Class A Common Stock,$191.47,6.41,3.464%,577445757.00,United States,,22531,Finance,Investment Managers
DIBS,1stdibs.com Inc. Common Stock,$5.33,-0.25,-4.48%,207500999.00,United States,2021,113756,Miscellaneous,Diversified Commercial Services
DICE,DICE Therapeutics Inc. Common Stock,$29.79,0.50,1.707%,1419877195.00,United States,2021,504667,Health Care,Biotechnology: Pharmaceutical Preparations
DIOD,Diodes Incorporated Common Stock,$94.00,0.17,0.181%,4275753842.00,United States,,218290,Technology,Semiconductors
DISA,Disruptive Acquisition Corporation I Class A Ordinary Shares,$11.25,0.26,2.366%,386718750.00,United States,2021,9596,Finance,Blank Checks
DISAW,Disruptive Acquisition Corporation I Warrant,$0.0557,0.0018,3.34%,0.00,United States,2021,16080,Finance,Blank Checks
DISH,DISH Network Corporation Class A Common Stock,$14.15,0.05,0.355%,7509496565.00,United States,1995,3474166,Consumer Discretionary,Telecommunications Equipment
DISTU,Distoken Acquisition Corporation Unit,$10.19,-0.02,-0.196%,0.00,China,2023,289823,Finance,Blank Checks
DJCO,Daily Journal Corp. (S.C.) Common Stock,$295.22,-13.46,-4.361%,406525616.00,United States,,2360,Technology,Retail: Computer Software & Peripheral Equipment
DKDCA,Data Knights Acquisition Corp. Class A Common Stock,$10.625,0.00,0.00%,65788077.00,United Kingdom,2021,5,Industrials,Consumer Electronics/Appliances
DKNG,DraftKings Inc. Class A Common Stock,$20.54,2.73,15.328%,9219342747.00,United States,2019,81807679,Consumer Discretionary,Services-Misc. Amusement & Recreation
DLHC,DLH Holdings Corp.,$13.05,-0.04,-0.306%,179528445.00,United States,,44193,Consumer Discretionary,Business Services
DLO,DLocal Limited Class A Common Shares,$15.64,-0.21,-1.325%,4629206823.00,Uruguay,2021,927857,Consumer Discretionary,Business Services
DLPN,Dolphin Entertainment Inc. Common Stock,$2.21,-0.05,-2.212%,22573055.00,United States,,5252,Consumer Discretionary,Advertising
DLTH,Duluth Holdings Inc. Class B Common Stock,$6.24,0.09,1.463%,208557679.00,United States,2015,182404,Consumer Discretionary,Department/Specialty Retail Stores
DLTR,Dollar Tree Inc. Common Stock,$148.04,1.19,0.81%,32744150271.00,United States,1995,1710557,Consumer Discretionary,Department/Specialty Retail Stores
DMAC,DiaMedica Therapeutics Inc. Common Stock,$1.68,0.06,3.704%,44424353.00,United States,2018,38044,Health Care,Pharmaceuticals and Biotechnology
DMAQ,Deep Medicine Acquisition Corp. Class A Common Stock,$10.36,0.06,0.583%,47794928.00,United States,2021,1588,Industrials,Consumer Electronics/Appliances
DMAQR,Deep Medicine Acquisition Corp. Rights,$0.10,0.00,0.00%,0.00,United States,2021,80,,
DMLP,Dorchester Minerals L.P. Common Units Representing Limited Partnership Interests,$29.62,-0.68,-2.244%,1136563623.00,United States,,64461,Energy,Oil & Gas Production
DMRC,Digimarc Corporation Common Stock,$22.56,0.44,1.989%,452011145.00,United States,,125237,Technology,EDP Services
DMTK,DermTech Inc. Common Stock,$4.86,-0.19,-3.762%,146843466.00,United States,2017,410817,Health Care,Managed Health Care
DNAB,Social Capital Suvretta Holdings Corp. II Class A Ordinary Shares,$10.15,0.00,0.00%,323683500.00,United States,2021,61162,Finance,Blank Checks
DNAD,Social Capital Suvretta Holdings Corp. IV Class A Ordinary Shares,$10.16,-0.01,-0.098%,324002400.00,United States,2021,65724,Finance,Blank Checks
DNLI,Denali Therapeutics Inc. Common Stock,$30.52,0.96,3.248%,4145033147.00,United States,2017,472397,Health Care,Biotechnology: Biological Products (No Diagnostic Substances)
DNUT,Krispy Kreme Inc. Common Stock,$13.11,-0.47,-3.461%,2195100683.00,United States,2021,832938,Consumer Discretionary,Specialty Foods
DOCU,DocuSign Inc. Common Stock,$64.47,-2.18,-3.271%,12963250322.00,United States,2018,3596655,Technology,EDP Services
DOGZ,Dogness (International) Corporation Class A Common Stock,$0.9712,-0.0238,-2.392%,38143160.00,China,2017,16243,Consumer Discretionary,Miscellaneous manufacturing industries
DOMH,Dominari Holdings Inc. Common Stock,$3.90,0.14,3.723%,21391874.00,United States,,15301,Health Care, Medicinal Chemicals and Botanical Products 
DOMO,Domo Inc. Class B Common Stock,$15.17,-0.52,-3.314%,524047134.00,United States,2018,1147425,Technology,Computer Software: Prepackaged Software
DOOO,BRP Inc. (Recreational Products) Common Subordinate Voting Shares,$88.97,-0.06,-0.067%,7005984199.00,Canada,,18590,,
DORM,Dorman Products Inc. Common Stock,$96.87,2.39,2.53%,3043517360.00,United States,,58447,Consumer Discretionary,Auto Parts:O.E.M.
DOX,Amdocs Limited Ordinary Shares,$94.84,-0.78,-0.816%,11436565920.00,Guernsey,,563140,Technology,EDP Services
DOYU,DouYu International Holdings Limited ADS,$1.48,-0.09,-5.732%,469876083.00,China,2019,874497,Technology,Computer Software: Programming Data Processing
DPCSW,DP Cap Acquisition Corp I Warrants,$0.0277,-0.0055,-16.566%,0.00,United States,2021,7711,Finance,Blank Checks
DPRO,Draganfly Inc. Common Shares,$2.19,-0.08,-3.524%,74025353.00,Canada,,601647,Consumer Discretionary,Electronic Components
DRCT,Direct Digital Holdings Inc. Class A Common Stock,$4.70,-0.26,-5.242%,66636600.00,United States,2022,114818,Consumer Discretionary,Advertising
DRCTW,Direct Digital Holdings Inc. Warrant,$0.99,-0.21,-17.50%,0.00,United States,2022,6194,Consumer Discretionary,Advertising
DRIO,DarioHealth Corp. Common Stock,$5.17,-0.09,-1.711%,133184370.00,Israel,,63754,Health Care,Medical/Dental Instruments
DRMA,Dermata Therapeutics Inc. Common Stock,$0.2894,0.0046,1.615%,3565943.00,United States,2021,63167,Health Care,Biotechnology: Pharmaceutical Preparations
DRMAW,Dermata Therapeutics Inc. Warrant,$0.03,-0.0335,-52.756%,0.00,United States,2021,27615,Health Care,Biotechnology: Pharmaceutical Preparations
DRRX,DURECT Corporation Common Stock,$5.10,-0.07,-1.354%,116208513.00,United States,2000,37993,Health Care,Biotechnology: Pharmaceutical Preparations
DRS,Leonardo DRS Inc. Common Stock,$13.16,0.11,0.843%,3424064342.00,Israel,,482799,Industrials,Military/Government/Technical
DRTS,Alpha Tau Medical Ltd. Ordinary Shares,$3.46,0.04,1.17%,238779963.00,Israel,,45030,Health Care,Biotechnology: Pharmaceutical Preparations
DRTSW,Alpha Tau Medical Ltd. Warrant,$0.3997,0.0297,8.027%,0.00,Israel,,20027,Health Care,Biotechnology: Pharmaceutical Preparations
DRTT,DIRTT Environmental Solutions Ltd. Common Shares,$0.6741,0.0186,2.838%,65645469.00,Canada,,32601,,
DRUG,Bright Minds Biosciences Inc. Common Stock,$0.72,-0.0001,-0.014%,13471458.00,Canada,,79241,Health Care,Pharmaceuticals and Biotechnology
DRVN,Driven Brands Holdings Inc. Common Stock,$28.71,-0.57,-1.947%,4806170189.00,United States,2021,444845,,
DSEY,Diversey Holdings Ltd. Ordinary Shares,$5.92,-0.07,-1.169%,1919950501.00,United States,2021,264774,Consumer Discretionary,Specialty Chemicals
DSGN,Design Therapeutics Inc. Common Stock,$7.635,0.855,12.611%,426873392.00,United States,2021,371177,Health Care,Biotechnology: Pharmaceutical Preparations
DSGR,Distribution Solutions Group Inc. Common Stock,$46.79,1.47,3.244%,922330890.00,United States,,26816,Industrials,Industrial Machinery/Components
DSGX,Descartes Systems Group Inc. (The) Common Stock,$75.14,-0.13,-0.173%,6373224069.00,Canada,,113526,,
DSKE,Daseke Inc. Common Stock,$8.45,-0.07,-0.822%,379194519.00,United States,2015,294683,,
DSP,Viant Technology Inc. Class A Common Stock,$4.56,-0.09,-1.935%,65937983.00,United States,2021,29820,Technology,EDP Services
DSWL,Deswell Industries Inc. Common Shares,$3.03,0.00,0.00%,48283774.00,Macau,1995,1248,Industrials,Plastic Products
DTEA,DAVIDsTEA Inc. Common Stock,$0.974,0.014,1.458%,25880188.00,Canada,2015,5737,,
DTIL,Precision BioSciences Inc. Common Stock,$1.22,0.01,0.826%,135369925.00,United States,2019,1029535,Health Care,Biotechnology: Pharmaceutical Preparations
DTOC,Digital Transformation Opportunities Corp. Class A Common Stock,$10.13,0.00,0.00%,422294375.00,United States,2021,55507,Industrials,Consumer Electronics/Appliances
DTOCU,Digital Transformation Opportunities Corp. Units,$10.13,0.00,0.00%,0.00,United States,2021,14480,Industrials,Consumer Electronics/Appliances
DTOCW,Digital Transformation Opportunities Corp. Warrant,$0.065,0.0149,29.741%,0.00,United States,2021,300,Industrials,Consumer Electronics/Appliances
DTSS,Datasea Inc. Common Stock,$1.2564,-0.0372,-2.876%,30561469.00,China,,11170,Technology,Retail: Computer Software & Peripheral Equipment
DTST,Data Storage Corporation Common Stock,$1.86,-0.0312,-1.65%,12689156.00,United States,,23120,Technology,EDP Services
